"BibliographyType","ISBN","Identifier","Author","Title","Journal","Volume","Number","Month","Pages","Year","Address","Note","URL","Booktitle","Chapter","Edition","Series","Editor","Publisher","ReportType","Howpublished","Institution","Organizations","School","Annote","Custom1","Custom2","Custom3","Custom4","Custom5","DOI"
"7","","8669948","Aleem, S.; Ahmed, F.; Batool, R.; Khattak, A.","Empirical Investigation of Key Factors for SaaS Architecture Dimension","IEEE Transactions on Cloud Computing","","","","1","2019","","","","","","","","","","","","","","","","","","Software as a service;Computer architecture;Scalability;Cloud computing;Technological innovation;Databases;SaaS architecture;SaaS development guidelines;SaaS Customization;SaaS MTA;SaaS Scalability;SaaS Security;SaaS Fault Tolerance","","","10.1109/TCC.2019.2906299"
"7","","8712496","Qasem, Y. A. M.; Abdullah, R.; Jusoh, Y. Y.; Atan, R.; Asadi, S.","Cloud Computing Adoption in Higher Education Institutions: A Systematic Review","IEEE Access","7","","","63722--63744","2019","","","","","","","","","","","","","","","","","","cloud computing;computer aided instruction;educational institutions;further education;HEIs;cloud computing adoption;higher education institutions;everything-as-a-service;Taxonomy;Education;Cloud computing;Systematics;Organizations;Bibliographies;Cloud computing;adoption;higher education institutions;systematic literature review;taxonomy","","","10.1109/ACCESS.2019.2916234"
"7","","8747000","Ali, A. Q.; Sultan, A. B. M.; Ghani, A. A. A.; Zulzalil, H.","A Systematic Mapping Study on the Customization Solutions of Software as a Service Applications","IEEE Access","7","","","88196--88217","2019","","","","","","","","","","","","","","","","","","cloud computing;software maintenance;software quality;user interfaces;SaaS customization assessment;quality attributes;systematic mapping approach;SaaS customization problems;customization types;SaaS customization solutions;software quality problems;primary studies;software as a service applications;Software as a service;Systematics;Libraries;Maintenance engineering;Databases;Engines;Customization types;multi-layered architecture;quality attributes;software as a service;systematic mapping","","","10.1109/ACCESS.2019.2925499"
"6","","8792654","M{\{u}}nch, J.; Trieflinger, S.; Lang, D.","Product Roadmap – From Vision to Reality: A Systematic Literature Review","","","","","1--8","2019","","","","2019 IEEE International Conference on Engineering, Technology and Innovation (ICE/ITMC)","","","","","","","","","","","","","","business data processing;data visualisation;product development;roadmap types;scientific literature;product roadmap;systematic literature review;product roadmapping;roadmapping processes;companies;highly dynamic markets;product development;customer behaviors;business modeling;product vision;product discovery activities;Systematics;Organizations;Bibliographies;Computer science;Conferences;Technological innovation;product management;product strategy;product vision;product roadmap;roadmapping;product discovery;agile development","","","10.1109/ICE.2019.8792654"
"6","","8812848","Nistala, P.; Nori, K. V.; Reddy, R.","Software Quality Models: A Systematic Mapping Study","","","","","125--134","2019","","","","2019 IEEE/ACM International Conference on Software and System Processes (ICSSP)","","","","","","","","","","","","","","Product Quality, Quality Architecture, Quality Characteristic, Quality Meta Model, Quality Model, Quality Pattern, Quality Realization, Reference architecture, Software Process,quality control;software architecture;software quality;architecting quality;quality architecture;quality planning phase;quality assessment;quality documentation;quality realization aspect;quality realization mechanisms;software quality models;quality attributes;meta-model elements;Bayer's reference architecture framework;architecture phase mapping analysis;Object oriented modeling;ISO Standards;Software quality;Computer architecture;Analytical models;Systematics;Software Quality","","","10.1109/ICSSP.2019.00025"
"6","","8960866","Acosta, N. D.; Garcia, M. B.; Romero, J. B.; Sevillano, A. L.; Paez, N. F.; Roa, O.","Educational trends in software engineering: a systematic review study","","","","","1--4","2019","","","","2019 Congreso Internacional de Innovaci{\'{o}}n y Tendencias en Ingenieria (CONIITI )","","","","","","","","","","","","","","computer science education;educational courses;graphical user interfaces;Java;object-oriented programming;programming languages;public domain software;software architecture;software quality;Java programming language;graphical user interface;C programming language;C ++ programming language;Catholic University of Colombia;software engineering area;cloud services;mobile software;computer-aided software engineering;prototype-based software development;object-oriented programming;software quality;software design;computer engineering program;updated knowledge;Course;curriculum;learning;Software engineering;teaching","","","10.1109/CONIITI48476.2019.8960866"
"6","","9026004","Edison, H.; Duc, A. N.; Jabangwe, R.; Wang, X.; Abrahamsson, P.","An Investigation into Software Product Innovation: A Systematic Literature Review","","","","","1--9","2016","","","","2016 International Conference on Engineering, Technology and Innovation/IEEE lnternational Technology Management Conference (ICE/ITMC)","","","","","","","","","","","","","","Technological innovation;Software;Bibliographies;Systematics;Software engineering;Databases;Data mining;software product innovation;systematic literature review;empirical evidence","","","10.1109/ICE/ITMC39735.2016.9026004"
"7","","ABDELMABOUD2015159","Abdelmaboud, Abdelzahir; Jawawi, Dayang N. A.; Ghani, Imran; Elsafi, Abubakar; Kitchenham, Barbara","Quality of service approaches in cloud computing: A systematic mapping study","Journal of Systems and Software","101","","","159--179","2015","","","http://www.sciencedirect.com/science/article/pii/S0164121214002830","","","","","","","","","","","","","Context: Cloud computing is a new computing technology that provides services to consumers and businesses. Due to the increasing use of these services, the quality of service (QoS) of cloud computing has become an important and essential issue since there are many open challenges which need to be addressed related to trust in cloud services. Many research issues have been proposed in QoS approaches in the cloud computing area. Objective: The aim of this study is to survey current research on QoS approaches in cloud computing in order to identify where more emphasis should be placed in both current and future research directions. Method: A systematic mapping study was performed to find the related literature, and 67 articles were selected as primary studies that are classified in relation to the focus, research type and contribution type. Result: The majority of the articles are of the validation research type (64{\%}). Infrastructure as a service (48{\%}) was the largest research focus area, followed by software as a service (36{\%}). The majority of contributions concerned methods (48{\%}), followed by models (32{\%}). Conclusion: The results of this study confirm that QoS approaches in cloud computing have become an important topic in the cloud computing area in recent years and there remain open challenges and gaps which require future research exploration. In particular, tools, metrics and evaluation research are needed in order to provide useful and trustworthy cloud computing services that deliver appropriate QoS.","","Cloud services, Systematic mapping study,Quality of service","","","https://doi.org/10.1016/j.jss.2014.12.015"
"7","","ALABOOL2018161","Alabool, Hamzeh; Kamil, Ahmad; Arshad, Noreen; Alarabiat, Deemah","Cloud service evaluation method-based Multi-Criteria Decision-Making: A systematic literature review","Journal of Systems and Software","139","","","161--188","2018","","","http://www.sciencedirect.com/science/article/pii/S0164121218300244","","","","","","","","","","","","","A substantial effort has been made to solve the cloud-service evaluation problem. Different Cloud Service Evaluation Methods (CSEMs) have been developed to address the problem. Cloud services are evaluated against multiple criteria, which leads to a Multi-Criteria Decision-Making (MCDM) problem. Yet, studies that assess, analyse, and summarize the unresolved problems and shortcomings of current CSEM-based MCDM are limited. In the existing review studies, only individual parts of CSEMs, rarely the full solution, are reviewed and examined. To investigate CSEMs comprehensively, we present a systematic literature review based on Evaluation Theory, a theory that generalizes six evaluation components, target, criteria, yardstick, data gathering techniques, synthesis techniques, and evaluation process. These six evaluation components and the CSEMs validation approach are the seven dimensions used to assess and analyse 77 papers published from 2006 to 2016. Sixteen research deficiencies were identified. The results confirm that the majority of the studies of the proposed CSEMs were either incomplete or lacked sufficient evidence. This research not only provides the relative strengths and weaknesses of the different CSEMs but also offers a basis for researchers and decision makers to develop improved CSEMs.","","Cloud service evaluation method, Evaluation theory, Multi-Criteria Decision-Making (MCDM), Systematic literature review,Cloud computing service","","","https://doi.org/10.1016/j.jss.2018.01.038"
"6","","c","Durelli, R. S.; Santib{\'{a}}{\~{n}}ez, D. S. M.; Marinho, B.; Honda, R.; Delamaro, M. E.; Anquetil, N.; de Camargo, V. V.","A mapping study on architecture-driven modernization","","","","","577--584","2014","","","","Proceedings of the 2014 IEEE 15th International Conference on Information Reuse and Integration (IEEE IRI 2014)","","","","","","","","","","","","","","software maintenance;architecture-driven modernization process;software engineering activities;object management group;OMG;ADM;systematic mapping study;electronic databases;software modernization area;legacy systems;Systematics;Aging;Databases;Software;Data mining;Measurement;Standards;Systematic Mapping;Architecture-Driven Modernization;ADM;Knowledge Discovery Metamodel;KDM","","","10.1109/IRI.2014.7051941"
"7","","CAVALCANTE201617","Cavalcante, Everton; Pereira, Jorge; Alves, Marcelo Pitanga; Maia, Pedro; Moura, Roniceli; Batista, Thais; Delicato, Flavia C.; Pires, Paulo F.","On the interplay of Internet of Things and Cloud Computing: A systematic mapping study","Computer Communications","89-90","","","17--33","2016","","","http://www.sciencedirect.com/science/article/pii/S0140366416300706","","","","","","","","","","","","Internet of Things$\backslash$: Research challenges and Solutions","The Internet of Things (IoT) is a novel paradigm relying on the interaction of smart objects (things) with each other and with physical and/or virtual resources through the Internet. Despite the recent advances that have made IoT a reality, there are several challenges to be addressed towards exploiting its full potential and promoting tangible benefits to society, environment, economy, and individual citizens. Recently, Cloud Computing has been advocated as a promising approach to tackle some of the existing challenges in IoT while leveraging its adoption and bringing new opportunities. With the combination of IoT and Cloud Computing, the cloud becomes an intermediate layer between smart objects and applications that make use of data and resources provided by these objects. On the one hand, IoT can benefit from the almost unlimited resources of Cloud Computing to implement management and composition of services related to smart objects and their provided data. On the other hand, the cloud can benefit from IoT by broadening its operation scope to deal with real-world objects. In spite of this synergy, the literature still lacks of a broad, comprehensive overview on what has been investigated on the integration of IoT and Cloud Computing and what are the open issues to be addressed in future research and development. The goal of this work is to fill this gap by systematically collecting and analyzing studies available in the literature aiming to: (i) obtain a comprehensive understanding on the integration of IoT and Cloud Computing paradigms; (ii) provide an overview of the current state of research on this topic; and (iii) identify important gaps in the existing approaches as well as promising research directions. To achieve this goal, a systematic mapping study was performed covering papers recently published in journals, conferences, and workshops, available at five relevant electronic databases. As a result, 35 studies were selected presenting strategies and solutions on how to integrate IoT and Cloud Computing as well as scenarios, research challenges, and opportunities in this context. Besides confirming the increasing interest on the integration of IoT and Cloud Computing, this paper reports the main outcomes of the performed systematic mapping by both presenting an overview of the state of the art on the investigated topic and shedding light on important challenges and potential directions to future research.","","Cloud Computing, IoT, Systematic mapping,Internet of Things","","","https://doi.org/10.1016/j.comcom.2016.03.012"
"7","","doi:10.1002/spe.2409","Chauhan, Muhammad Aufeef; Babar, Muhammad Ali; Benatallah, Boualem","Architecting cloud-enabled systems: a systematic survey of challenges and solutions","Software: Practice and Experience","47","4","","599--644","2017","","","https://onlinelibrary.wiley.com/doi/abs/10.1002/spe.2409","","","","","","","","","","","","","Summary The literature on the challenges of and potential solutions to architecting cloud-based systems is rapidly growing but is scattered. It is important to systematically analyze and synthesize the existing research on architecting cloud-based software systems in order to build a cohesive body of knowledge of the reported challenges and solutions. We have systematically identified and reviewed 133 papers that report architecture-related challenges and solutions for cloud-based software systems. This paper reports the methodological details, findings, and implications of a systematic review that has enabled us to identify 44 unique categories of challenges and associated solutions for architecting cloud-based software systems. We assert that the identified challenges and solutions classified into the categories form a body of knowledge that can be leveraged for designing or evaluating software architectures for cloud-based systems. Our key conclusions are that a large number of primary studies focus on middleware services aimed at achieving scalability, performance, response time, and efficient resource optimization. Architecting cloud-based systems presents unique challenges as the systems to be designed range from pervasive embedded systems and enterprise applications to smart devices with Internet of Things. We also conclude that there is a huge potential of research on architecting cloud-based systems in areas related to green computing, energy efficient systems, mobile cloud computing, and Internet of Things. Copyright {\textcopyright} 2016 John Wiley {\&} Sons, Ltd.","","software architecture, systematic literature review,cloud computing","","","10.1002/spe.2409"
"7","","doi:10.1142/S0219649220400109","Ridha, Samah; Senapathi, Mali","Requirements Engineering in Cloud and Service-Oriented Systems: A Systematic Mapping Study","Journal of Information {\&} Knowledge Management","0","0","","2040010","","","","https://doi.org/10.1142/S0219649220400109","","","","","","","","","","","","","The domain of Cloud and Service-oriented requirements engineering (SORE) focuses on modelling, specifying, and analysing requirements to enable software development in a service-oriented manner. Even though Cloud and SORE has received increasing attention over the past decade, there is no clear view of the current state of knowledge. Our goal is to gain insights into the current status of Cloud and SORE research published to date. To this end, we conducted a systematic mapping study to develop a map to classify relevant literature published between 2007 and 2018. Out of the 326 studies that were examined, we selected 24 studies as primary studies. The resulting map provides an overview of the existing work on Cloud and SORE and makes it possible to identify gaps and plan and position future research. Our findings suggest that Cloud and SORE as a research context needs specific attention. More evaluation and validation research is needed to better understand the implementation and impact of the various solutions (e.g. frameworks, tools) that are proposed in the Cloud and SORE context.","","","","","10.1142/S0219649220400109"
"7","","Durao2014","Durao, Frederico; Carvalho, Jose Fernando S.; Fonseka, Anderson; Garcia, Vinicius Cardoso","A systematic review on cloud computing","The Journal of Supercomputing","68","3","","1321--1346","2014","","","https://doi.org/10.1007/s11227-014-1089-x","","","","","","","","","","","","","Cloud computing is an ascending technology that has introduced a new paradigm by rendering a rational computational model possible. It has changed the dynamics of IT consumption by means of a model that provides on-demand services over the Internet. Unlike the traditional hosting service, cloud computing services are paid for per usage and may expand or shrink based on demand. Such services are, in general, fully managed by cloud providers that require users nothing but a personal computer and an Internet access. In recent years, this model has attracted the attention of researchers, investors and practitioners, many of whom have proposed a number of applications, structures and fundamentals of cloud computing, resulting in various definitions, requirements and models. Despite the interest and advances in the field, issues such as security and privacy, service layer agreement, resource sharing, and billing have opened up new questions about the real gains of the model. Although cloud computing is based on a 50-year-old business model, evidence from this study indicates that cloud computing still needs to expand and overcome present limitations that prevent the full use of its potential. In this study, we critically review the state of the art in cloud computing with the aim of identifying advances, gaps and new challenges.","","","","","10.1007/s11227-014-1089-x"
"7","","EDISON20181","Edison, Henry; Wang, Xiaofeng; Jabangwe, Ronald; Abrahamsson, Pekka","Innovation Initiatives in Large Software Companies: A Systematic Mapping Study","Information and Software Technology","95","","","1--14","2018","","","http://www.sciencedirect.com/science/article/pii/S0950584917303051","","","","","","","","","","","","","Context To keep the competitive advantage and adapt to changes in the market and technology, companies need to innovate in an organised, purposeful and systematic manner. However, due to their size and complexity, large companies tend to focus on the structure in maintaining their business, which can potentially lower their agility to innovate. Objective The aims of this study are to provide an overview of the current research on innovation initiatives and to identify the challenges of implementing those initiatives in the context of large software companies. Method The investigation was primarily performed using a systematic mapping approach of published literature on corporate innovation and entrepreneurship, which was then complemented with interviews with four experts with rich industry experience. Results Our mapping study results suggest that, there is a lack of high quality empirical studies on innovation initiative in the context of large software companies. A total of 7 studies are conducted in the context of large software companies, which reported 5 types of initiatives: intrapreneurship, bootlegging, internal venture, spin-off and crowdsourcing. Our study offers three contributions. First, this paper represents the map of existing literature on innovation initiatives inside large companies. The second contribution of this paper is to provide an innovation initiative tree. The third contribution is to identify key challenges faced by each initiative in large software companies. Conclusions At the strategic and tactical levels, there is no difference between large software companies and other companies. At the operational level, large software companies are highly influenced by the advancement of Internet technology. In addition, large software companies use open innovation paradigm as part of their innovation initiatives. We envision our future work is to further empirically evaluate the innovation initiative tree in large software companies. More practitioners from different companies should be involved in the future studies.","","Corporate entrepreneurship, Corporate innovation, Innovation initiative, Large software companies, Systematic mapping study,Innovation","","","https://doi.org/10.1016/j.infsof.2017.12.007"
"7","","GONZALEZMARTINEZ2015132","Gonz{\'{a}}lez-Mart{\'{i}}nez, Jos{\'{e}} A.; Bote-Lorenzo, Miguel L.; G{\'{o}}mez-S{\'{a}}nchez, Eduardo; Cano-Parra, Rafael","Cloud computing and education: A state-of-the-art survey","Computers {\&} Education","80","","","132--151","2015","","","http://www.sciencedirect.com/science/article/pii/S0360131514001985","","","","","","","","","","","","","This paper surveys the state of the art on the use and research of cloud computing in education following a systematic methodology. After a comprehensive search of the scientific literature, 112 works were selected for the review. The survey identifies and analyzes the advantages and risks that the use of cloud computing may have for the main stakeholders in education, which can be useful to identify the scenarios in which the use of cloud computing in an educational context may have significant advantages. Furthermore, the survey categorizes and discusses the main technical and domain-specific research challenges, thus facilitating researchers the task of finding relevant issues, in which they can focus their efforts.","","Distributed learning environments, Improving classroom teaching, Interactive learning environments, Public spaces and computing,Architectures for educational technology system","","","https://doi.org/10.1016/j.compedu.2014.08.017"
"7","","HEREDIA2015395","Heredia, Alberto; Colomo-Palacios, Ricardo; de Amescua, Antonio","Software Business Models from a Distribution Perspective: A Systematic Mapping Study","Procedia Computer Science","64","","","395--402","2015","","","http://www.sciencedirect.com/science/article/pii/S1877050915026514","","","","","","","","","","","","Conference on ENTERprise Information Systems/International Conference on Project MANagement/Conference on Health and Social Care Information Systems and Technologies, CENTERIS/ProjMAN / HCist 2015 October 7-9, 2015","Business models (BMs) describe how a company creates and delivers value to customers, the products or services that it offers and the compensation for them. Software companies need to be able to adopt different BMs to be successful in modern economy. Despite the number of publications on the field, there is still not a clear picture of software BMs. The purpose of this study is to structure and characterize the state of the art on software BMs with focus on sales and distribution models to help discover possible research gaps. The authors of this study conducted a systematic mapping study using relevant keywords to identify primary studies in the existing literature related to software BMs from a business management perspective. The search strategy returned 1871 papers and 51 were selected as primary studies. The analysis of results helps clarify the picture of software BMs and highlights the most relevant sources of papers. Results also reveal the broad interest of researchers on this topic. Most of the primary studies were related to service-based BMs, and to a lesser extent on product-based or open-source-based BMs; there is also an increase in the attention of researchers towards models built around mobile apps. While many authors report experience papers, only some authors validate or evaluate new proposals of sales and distribution models.","","SaaS, mobile apps., on-premise software, open-source software, systematic mapping,software business models","","","https://doi.org/10.1016/j.procs.2015.08.516"
