"BibliographyType","ISBN","Identifier","Author","Title","Journal","Volume","Number","Month","Pages","Year","Address","Note","URL","Booktitle","Chapter","Edition","Series","Editor","Publisher","ReportType","Howpublished","Institution","Organizations","School","Annote","Custom1","Custom2","Custom3","Custom4","Custom5","DOI"
"6","978-3-030-05532-5","10.1007/978-3-030-05532-5_6","Bermeo Conto, Jorge; Z{\'{u}}{\~{n}}iga-Prieto, Miguel; Solano-Quinde, Lizandro","A Systematic Mapping Study of Specification Languages in Cloud Services Development","","","","","72--88","2019","Cham","","","Technology Trends","","","","Botto-Tobar, Miguel; Pizarro, Guillermo; Z{\'{u}}{\~{n}}iga-Prieto, Miguel; D'Armas, Mayra; Z{\'{u}}{\~{n}}iga S{\'{a}}nchez, Miguel","Springer International Publishing","","","","","","","Specification languages offer abstractions and notations that facilitate the systematic and analytical reasoning about important aspects in a specific domain problematic. In a software engineering process domain, the usage of specification languages improve the quality and delivery time of the artefacts generated during the execution of the process activities. Cloud applications, or cloud services, are service-oriented applications whose consumption is constantly growing; however, their development require support for new roles and activities. In this work we are interested in knowing how specification languages are being used by researchers and practitioners to support the development of cloud services. This work presents a systematic mapping that provides guidance to determine the current state and to characterize the specification languages that support the service life cycle activities in a cloud services development domain.","","","","","https://doi.org/10.1007/978-3-030- 05532-5_6"
"6","978-3-030-30577-2","10.1007/978-3-030-30577-2_68","Odun-Ayo, Isaac; Geteloma, Victor; Misra, Sanjay; Ahuja, Ravin; Damasevicius, Robertas","Systematic Mapping Study of Utility-Driven Platforms for Clouds","","","","","762--774","2020","Cham","","","Proceedings of ICETIT 2019","","","","Singh, Pradeep Kumar; Panigrahi, Bijaya Ketan; Suryadevara, Nagender Kumar; Sharma, Sudhir Kumar; Singh, Amit Prakash","Springer International Publishing","","","","","","","Cloud computing is a dynamic paradigm that applies utility driven platforms at all layers to provide on-demand elastic services to the users. Utility driven platforms on the cloud makes the services easy to use and access by customers. There are several utility platforms available and many more are being developed. This makes utility driven platforms on the cloud an interesting area to research on. However, deciding on a specific research area that relates to utility driven platforms on the cloud could be a cumbersome process for a researcher. A systematic mapping study allows an aggregation of publication in an area of interest, which provides a summary of the extent of work done in that field. The specific objective is to conduct a systematic mapping study of utility driven platforms for clouds. The study in this paper were carried out using three categories or facets; the topic, research, and contribution facets. The results obtained indicated that there were more publications in terms of scheduling and algorithms in the area of metric with 0.96{\%}, more articles published on designs and architecture in terms of tool with 4.81{\%} each, more papers published on design in the area of model with 18.27{\%}, more paper on scheduling in the area of method with 6.73{\%}, and more papers on allocations in terms of process with 6.73{\%}. In addition, there were more articles published on design in the area of evaluation research with 9.24{\%}, more articles published on algorithms in terms of validation research with 6.72{\%}, more publications on design in terms of solution research with 11.76{\%}, more articles published on design in relation to philosophical papers with 2.52{\%}, more articles published on design in terms of experience with 3.36{\%} and more publications on scheduling in terms of opinion with 1.68{\%}. In this study, the clearly identified gaps in the field of utility driven platforms on the cloud should invigorate enthusiasm for further studies by researchers and industry professionals. This investigation plainly recognized holes in the field of utility driven stages on the cloud, which ought to invigorate enthusiasm for further examinations by scientists and industry professionals.","","","","","10.1007/978-3-030-30577-2_68"
"6","978-3-319-21410-8","10.1007/978-3-319-21410-8_55","Ibrahim, Mohamud Sheikh; Salleh, Norsaremah; Misra, Sanjay","Empirical Studies of Cloud Computing in Education: A Systematic Literature Review","","","","","725--737","2015","Cham","","","Computational Science and Its Applications -- ICCSA 2015","","","","Gervasi, Osvaldo; Murgante, Beniamino; Misra, Sanjay; Gavrilova, Marina L.; Rocha, Ana Maria Alves Coutinho; Torre, Carmelo; Taniar, David; Apduhan, Bernady O.","Springer International Publishing","","","","","","","The purpose of this paper is to present the evidence about adoption of cloud computing in the education system in universities or higher education institutions. We performed a systematic literature review (SLR) of empirical studies that investigated the current level of adoption of cloud computing in the education systems and motivations for using cloud computing in the institution. Seven papers were included in our synthesis of evidence. It has been found that several universities are interested in using cloud computing in their education systems, and they have utilized different types of cloud computing service models (IaaS, PaaS, SaaS). The results of this SLR show that a clear gap exists in this research field: a lack of empirical studies focusing on utilizing cloud computing within educational institutions.","","","","","10.1007/978-3-319-21410-8_55"
"6","978-3-319-62407-5","10.1007/978-3-319-62407-5_14","Vural, Hulya; Koyuncu, Murat; Guney, Sinem","A Systematic Literature Review on Microservices","","","","","203--217","2017","Cham","","","Computational Science and Its Applications -- ICCSA 2017","","","","Gervasi, Osvaldo; Murgante, Beniamino; Misra, Sanjay; Borruso, Giuseppe; Torre, Carmelo M.; Rocha, Ana Maria A. C.; Taniar, David; Apduhan, Bernady O.; Stankova, Elena; Cuzzocrea, Alfredo","Springer International Publishing","","","","","","","The cloud is an emerging paradigm which leads the way for different approaches and standards. The architectural styles are evolving based on the requirements of the cloud as well. In recent years microservices is seen as the architecture style for scalable, fast evolving cloud applications. As part of this paper, a systematic mapping study was carried out around microservices. It is aiming to find out the current trends around microservices, the motivation behind microservices research, emerging standards and the possible research gaps. The obtained results can help researchers and practitioner in software engineering domain who want to be aware of new trends about SOA and cloud computing.","","","","","10.1007/978-3-319-62407-5_14"
"6","978-3-319-62407-5","10.1007/978-3-319-62407-5_24","Wanderley, Fernando; Souza, Eric; Goul{\~{a}}o, Miguel; Araujo, Joao; Cysneiros, Gilberto; Misra, Ananya","Requirements Engineering for Cloud Systems: A Mapping Study Design","","","","","335--349","2017","Cham","","","Computational Science and Its Applications -- ICCSA 2017","","","","Gervasi, Osvaldo; Murgante, Beniamino; Misra, Sanjay; Borruso, Giuseppe; Torre, Carmelo M.; Rocha, Ana Maria A. C.; Taniar, David; Apduhan, Bernady O.; Stankova, Elena; Cuzzocrea, Alfredo","Springer International Publishing","","","","","","","Cloud Computing gets increasingly established in industrial practice as an option for modelling cost-efficient and demand-oriented information systems. Despite the increasing acceptance of cloud computing within the industry, many important questions remain unanswered. Issues related to the best software architectures decisions for cloud-based systems are faced with the question of appropriate techniques applying at early phase like requirements engineering. The goal of this paper defines a design of a mapping study to verify and identify the existence of relevant research gaps, which refers mainly to requirements models, tools or methods for cloud systems (SaaS). The conclusion of this mapping study design reinforces and actively encourages the necessity of the complete execution (and replication) of a systematic mapping study regarding the synergy of requirements engineering (e.g.: with model-driven issues) applied for a cloud computing.","","","","","10.1007/978-3-319-62407-5_24"
"6","978-3-319-67283-0","10.1007/978-3-319-67283-0_1","Botto-Tobar, Miguel; Ramirez-Anormaliza, Richard; Cevallos-Torres, Lorenzo J.; Cevallos-Ayon, Edwin","Migrating SOA Applications to Cloud: A Systematic Mapping Study","","","","","3--16","2017","Cham","","","Technologies and Innovation","","","","Valencia-Garc{\'{i}}a, Rafael; Lagos-Ortiz, Katty; Alcaraz-M{\'{a}}rmol, Gema; Del Cioppo, Javier; Vera-Lucio, N{\'{e}}stor; Bucaram-Leverone, Martha","Springer International Publishing","","","","","","","Cloud Computing has emerged as an economical option to use IT resources when needed without considerations about where they are allocated or how they are delivered. Cloud Computing expands the SOA capabilities by adding scalability, elasticity and other relevant quality attributes. In this context, many companies have started to migrate their SOA applications to Cloud environments without proper support. We conducted a systematic mapping study to gather the current knowledge about existing strategies for migrating SOA applications to cloud computing. 105 papers were identified and the results show that most of the approaches follow a semi-automated (conventional) strategy for migrating to the Cloud (93{\%}) and that most of the reported works follow a hybrid deployment model (60{\%}). We additionally identify several research gaps such as the need for more technology-independent solutions, a common definition for concepts and resources, tool support, and validation.","","","","","10.1007/978-3-319-67283-0_1"
"6","978-3-319-77703-0","10.1007/978-3-319-77703-0_85","Ferrer, Bastian; Quelopana, Aldo","Classifying Cloud Computing Challenges: A Taxonomy Proposal","","","","","877--886","2018","Cham","","","Trends and Advances in Information Systems and Technologies","","","","Rocha, {\'{A}}lvaro; Adeli, Hojjat; Reis, Lu{\'{i}}s Paulo; Costanzo, Sandra","Springer International Publishing","","","","","","","The rapid growth of Cloud Computing technology has made possible to conduct numerous studies and make investments in it to support the business models of organizations. However, this inclusion has been accompanied by several challenges which, although they have been actually studied, there is not still a consensus about how they can be classified inside the Information Systems field. This paper proposes a taxonomy to contribute to the solution of this problem, so that professionals and researchers can count on a common basis to focus on challenges with greater priority, eliminating ambiguities in their solution proposals.","","","","","10.1007/978-3-319-77703-0_85"
"7","","10.1145/2501654.2501669","Shaul, Levi; Tauber, Doron","Critical Success Factors in Enterprise Resource Planning Systems: Review of the Last Decade","ACM Comput. Surv.","45","4","","","2013","New York, NY, USA","","https://doi.org/10.1145/2501654.2501669","","","","","","Association for Computing Machinery","","","","","","","","","CSFs, Critical success factors, ERP, enterprise resource planning, literature review,information systems","","","10.1145/2501654.2501669"
"6","9781450333573","10.1145/2812428.2812442","Knutas, Antti; Hajikhani, Arash; Salminen, Juho; Ikonen, Jouni; Porras, Jari","Cloud-Based Bibliometric Analysis Service for Systematic Mapping Studies","","","","","184--191","2015","New York, NY, USA","","https://doi.org/10.1145/2812428.2812442","Proceedings of the 16th International Conference on Computer Systems and Technologies","","","CompSysTech '15","","Association for Computing Machinery","","","","","","","","","R SaaS bibliometric analysis citation analysis cloud computing social network analysi, systematic mapping studyliterature review","","","10.1145/2812428.2812442"
"7","","10.1145/3150227","Bergmayr, Alexander; Breitenb{\{u}}cher, Uwe; Ferry, Nicolas; Rossini, Alessandro; Solberg, Arnor; Wimmer, Manuel; Kappel, Gerti; Leymann, Frank","A Systematic Review of Cloud Modeling Languages","ACM Comput. Surv.","51","1","","","2018","New York, NY, USA","","https://doi.org/10.1145/3150227","","","","","","Association for Computing Machinery","","","","","","","","","Cloud computing, modeling,domain-specific languages","","","10.1145/3150227"
"6","9781450368544","10.1145/3340481.3342731","Saltan, Andrey","Do We Know How to Price SaaS: A Multi-Vocal Literature Review","","","","","7--12","2019","New York, NY, USA","","https://doi.org/10.1145/3340481.3342731","Proceedings of the 2nd ACM SIGSOFT International Workshop on Software-Intensive Business: Start-Ups, Platforms, and Ecosystems","","","IWSiB 2019","","Association for Computing Machinery","","","","","","","","","SaaS, pricing, software-as-a-service,multi-vocal literature review","","","10.1145/3340481.3342731"
"6","","6046201","Maglyas, A.; Nikula, U.; Smolander, K.","What do we know about software product management? - a systematic mapping study","","","","","26--35","2011","","","","2011 Fifth International Workshop on Software Product Management (IWSPM)","","","","","","","","","","","","","","software management;software product management;SPM;cloud environment;Software;Companies;Databases;Context;Project management;Systematics;systematic literature review;systematic mapping study;software product management;cloud environment;services","","","10.1109/IWSPM.2011.6046201"
"6","","6227789","Motta, G.; Sfondrini, N.; Sacco, D.","Cloud Computing: An Architectural and Technological Overview","","","","","23--27","2012","","","","2012 International Joint Conference on Service Sciences","","","","","","","","","","","","","","cloud computing;reviews;cloud computing;systematic literature review;data management;networking;Cloud computing;Computational modeling;Business;Systematics;Data mining;Servers;Cloud Computing;Literature Review;Cloud Deployment Model;Cloud Delivery Model;IT management","","","10.1109/IJCSS.2012.37"
"6","","6240421","Iankoulova, I.; Daneva, M.","Cloud computing security requirements: A systematic review","","","","","1--7","2012","","","","2012 Sixth International Conference on Research Challenges in Information Science (RCIS)","","","","","","","","","","","","","","authorisation;cloud computing;data integrity;data privacy;cloud computing security requirements;systematic literature review;access control;attack detection;harm detection;nonrepudiation;data integrity;data security;auditing;physical protection;data privacy;data recovery;prosecution;least researched sub-areas;most researched sub-areas;Cloud computing;Access control;Privacy;Fires;Data privacy;sequirity requirements engineering;cloud computing;Software-as-a-Service;empirical study;systematic literature review","","","10.1109/RCIS.2012.6240421"
"7","","6624108","Jamshidi, P.; Ahmad, A.; Pahl, C.","Cloud Migration Research: A Systematic Review","IEEE Transactions on Cloud Computing","1","2","","142--157","2013","","","","","","","","","","","","","","","","","","cloud computing;research and development;cloud migration research;software systems;business-critical systems;legacy applications;systematic literature review;SLR;characterization framework;legacy-to-cloud migration;architectural adaptation;self-adaptive cloud-enabled systems;Systematics;Service-oriented architecture;Semiconductor optical amplifiers;Research initiatives;Cloud computing;Cloud computing;cloud migration;legacy-to-cloud migration;systematic literature review","","","10.1109/TCC.2013.10"
"6","","6707171","Afify, Y. M.; Moawad, I. F.; Badr, N. L.; Tolba, M. F.","A semantic-based Software-as-a-Service (SaaS) discovery and selection system","","","","nov","57--63","2013","","","","2013 8th International Conference on Computer Engineering Systems (ICCES)","","","","","","","","","","","","","","cloud computing;meta data;ontologies (artificial intelligence);quality of service;software metrics;semantic-based software-as-a-service discovery;selection system;SaaS characteristics;cloud environment;quality of service attributes;QoS metrics;SaaS publication;unified ontology;services domain knowledge;hybrid service matchmaking algorithm;semantic-based metadata;ontology-based matching;Ontologies;Quality of service;Business;Measurement;Semantics;Software as a service;Computer architecture;Cloud Computing;SaaS;Publication;Discovery;Selection;Services Characteristics;QoS;Services Ontology","","","10.1109/ICCES.2013.6707171"
"6","","6716686","Alabool, H. M.; Mahmood, A. K.","Review on cloud service evaluation and selection methods","","","","nov","61--66","2013","","","","2013 International Conference on Research and Innovation in Information Systems (ICRIIS)","","","","","","","","","","","","","","cloud computing;quality of service;cloud service evaluation method;cloud service selection method;public cloud service;PCS;cloud service requesters;CSR needs;software engineering process;business process;CESM;quality of service;QoS;trust criteria;Cloud computing;Quality of service;Systematics;Security;Technological innovation;Information systems;Context;Public cloud computing;Evaluate and Select methods;Quality of Service;Systematic Review","","","10.1109/ICRIIS.2013.6716686"
"7","","7226855","Jatoth, C.; Gangadharan, G. R.; Buyya, R.","Computational Intelligence Based QoS-Aware Web Service Composition: A Systematic Literature Review","IEEE Transactions on Services Computing","10","3","","475--492","2017","","","","","","","","","","","","","","","","","","artificial intelligence;quality of service;research and development;Web services;computational intelligence based QoS-aware Web service composition;value added services;computational intelligence techniques;research approaches;future research directions;meta-heuristic algorithms;Web services;Quality of service;Optimization;Heuristic algorithms;Systematics;Bibliographies;Computational intelligence;Web service composition;systematic literature review;quality of service (QoS);research objectives;computational intelligence methods","","","10.1109/TSC.2015.2473840"
"6","","7306131","Guedes, G.; Silva, C.; Soares, M.; Castro, J.","Variability Management in Dynamic Software Product Lines: A Systematic Mapping","","","","","90--99","2015","","","","2015 IX Brazilian Symposium on Components, Architectures and Reuse Software","","","","","","","","","","","","","","software product lines;variability management;dynamic software product line;systematic mapping;product configuration;dynamically adaptive system;DSPL approach;variability binding;Unified modeling language;Runtime;Software product lines;Systematics;Adaptation models;Software;Quality assessment;variability management;dynamic software product lines;dynamically adaptive systems;systematic mapping","","","10.1109/SBCARS.2015.20"
"6","","7594056","Alkawsi, G. A.; Mahmood, A. K.; Baashar, Y. M.","Factors influencing the adoption of cloud computing in SME: A systematic review","","","","","220--225","2015","","","","2015 International Symposium on Mathematical Sciences and Computing Research (iSMSC)","","","","","","","","","","","","","","cloud computing;small-to-medium enterprises;social aspects of automation;cloud computing adoption;cloud computing acceptance;cloud computing diffusion;SME;Cloud computing;Biological system modeling;Computational modeling;Technological innovation;Organizations;Context;Databases;Cloud Computing;Adoption;SME","","","10.1109/ISMSC.2015.7594056"
"7","","7884954","Shahin, M.; Ali Babar, M.; Zhu, L.","Continuous Integration, Delivery and Deployment: A Systematic Review on Approaches, Tools, Challenges and Practices","IEEE Access","5","","","3909--3943","2017","","","","","","","","","","","","","","","","","","program testing;software fault tolerance;software houses;software maintenance;software engineering;software-intensive systems;maintenance projects;greenfield projects;design principles;transparency;team awareness;critical factors;deployment process dependability improvement;deployment process reliability improvement;scalability issues;security issues;fault detection;flaw detection;violation detection;semiautomated continuous testing;CI;test time reduction;build time reduction;thematic analysis method;continuous practices;systematic literature review method;software development industry practices;software deployment;software delivery;continuous integration;Software;Organizations;Software engineering;Systematics;Bibliographies;Testing;Production;Continuous integration;continuous delivery;continuous deployment;continuous software engineering;systematic literature review;empirical software engineering","","","10.1109/ACCESS.2017.2685629"
"7","","7922500","Pahl, C.; Brogi, A.; Soldani, J.; Jamshidi, P.","Cloud Container Technologies: A State-of-the-Art Review","IEEE Transactions on Cloud Computing","7","3","","677--692","2019","","","","","","","","","","","","","","","","","","cloud computing;cluster computing;virtual machines;virtualisation;cloud container technologies;lightweight technology;systematic mapping study;container orchestration space;cloud context;microservices development;continuous development;Containers;Cloud computing;Systematics;Computer architecture;Protocols;Data mining;Market research;Cloud;container;container technologies;orchestration;cluster;systematic review","","","10.1109/TCC.2017.2702586"
"7","","7922500","Pahl, C.; Brogi, A.; Soldani, J.; Jamshidi, P.","Cloud Container Technologies: A State-of-the-Art Review","IEEE Transactions on Cloud Computing","7","3","","677--692","2019","","","","","","","","","","","","","","","","","","cloud computing;cluster computing;virtual machines;virtualisation;cloud container technologies;lightweight technology;systematic mapping study;container orchestration space;cloud context;microservices development;continuous development;Containers;Cloud computing;Systematics;Computer architecture;Protocols;Data mining;Market research;Cloud;container;container technologies;orchestration;cluster;systematic review","","","10.1109/TCC.2017.2702586"
"7","","8016558","Mubeen, S.; Asadollah, S. A.; Papadopoulos, A. V.; Ashjaei, M.; Pei-Breivold, H.; Behnam, M.","Management of Service Level Agreements for Cloud Services in IoT: A Systematic Mapping Study","IEEE Access","6","","","30184--30207","2018","","","","","","","","","","","","","","","","","","cloud computing;contracts;Internet of Things;quality of service;QoS;quality of service;SLA management activities;cloud deployments;service consumers;service providers;cloud-based services;service-level agreements;cloud computing;systematic mapping study;IoT;cloud services;service level agreements;Cloud computing;Systematics;Internet of Things;Databases;Quality of service;Organizations;Service-level agreements;SLAs;Internet of Things;IoT;industrial IoT;IIoT;cloud computing;systematic mapping study","","","10.1109/ACCESS.2017.2744677"
"6","","8090268","Karataş, G.; Can, F.; Doğan, G.; Konca, C.; Akbulut, A.","Multi-tenant architectures in the cloud: A systematic mapping study","","","","","1--4","2017","","","","2017 International Artificial Intelligence and Data Processing Symposium (IDAP)","","","","","","","","","","","","","","cloud computing;storage management;multitenant architecture model;cloud-based applications;SaaS model;storage strategies;Software-as-a-Service;systematic mapping method;Computer architecture;Databases;Systematics;Software as a service;Service-oriented architecture;Cloud computing;cloud computing;multi-tenancy;multi-tenant architecture;systematic mapping study","","","10.1109/IDAP.2017.8090268"
"6","","8457888","Ferraz, F.; Ribeiro, F.; Lima, W.; Sampaio, C.","A Disturbing Question: What Is the Economical Impact of Cloud Computing? A Systematic Mapping","","","","","853--856","2018","","","","2018 IEEE 11th International Conference on Cloud Computing (CLOUD)","","","","","","","","","","","","","","cloud computing;computer centres;cloud computing technologies;in-house data centers;systematic mapping;economical impact;Cloud computing;Companies;Economics;Security;Systematics;Biological system modeling;Cloud Computing;Systematic Mapping;Economic Impacts;Challenges;Opportunities","","","10.1109/CLOUD.2018.00120"
"6","","8605787","Danielsson, J.; Tsog, N.; Kunnappilly, A.","A Systematic Mapping Study on Real-Time Cloud Services","","","","","245--251","2018","","","","2018 IEEE/ACM International Conference on Utility and Cloud Computing Companion (UCC Companion)","","","","","","","","","","","","","","cloud computing;real-time systems;resource allocation;safety-critical software;Web services;systematic mapping study;real-time cloud services;cloud computing;real-time applications;Internet;real-time safety-critical applications;predictable execution time properties;Cloud computing;Real-time systems;Systematics;Computer architecture;Software;Databases;Task analysis;Cloud computing;real-time;safety-critical applications;systematic mapping study","","","10.1109/UCC-Companion.2018.00063"
